{
  "$schema": "https://json-schema.org/draft/2020-12/schema",
  "$id": "https://github.com/danifunker/ODE-lookup-db/schema/disc.schema.json",
  "title": "Redump Disc",
  "description": "One disc entry, schema v1. Forward-compatible: readers must ignore unknown fields; writers omit null/unknown values.",
  "type": "object",
  "required": ["redump_id", "system", "title", "tracks", "redump_url", "schema_version"],
  "additionalProperties": true,
  "properties": {
    "schema_version": {
      "type": "integer",
      "const": 1
    },
    "redump_id": {
      "type": "integer",
      "minimum": 1
    },
    "system": {
      "type": "string",
      "enum": ["pc", "mac", "hybrid"]
    },
    "title": {
      "type": "string",
      "minLength": 1
    },
    "foreign_title": {
      "type": ["string", "null"]
    },
    "region": {
      "type": "array",
      "items": { "type": "string" }
    },
    "languages": {
      "type": "array",
      "items": {
        "type": "string",
        "pattern": "^[a-z]{2}$",
        "description": "ISO 639-1 code, or 'zz' for unmapped"
      }
    },
    "languages_raw": {
      "type": "array",
      "items": { "type": "string" },
      "description": "Original language strings as scraped from redump"
    },
    "edition": { "type": ["string", "null"] },
    "version": { "type": ["string", "null"] },
    "serials": {
      "type": "array",
      "items": { "type": "string" }
    },
    "barcode": { "type": ["string", "null"] },
    "category": { "type": ["string", "null"] },
    "pvd": {
      "type": ["object", "null"],
      "additionalProperties": true,
      "properties": {
        "volume_identifier": { "type": ["string", "null"] },
        "system_identifier": { "type": ["string", "null"] },
        "volume_set_identifier": { "type": ["string", "null"] },
        "publisher_identifier": { "type": ["string", "null"] },
        "data_preparer_identifier": { "type": ["string", "null"] },
        "application_identifier": { "type": ["string", "null"] },
        "creation_date": { "type": ["string", "null"] },
        "modification_date": { "type": ["string", "null"] },
        "expiration_date": { "type": ["string", "null"] },
        "effective_date": { "type": ["string", "null"] }
      }
    },
    "tracks": {
      "type": "array",
      "minItems": 1,
      "items": {
        "type": "object",
        "required": ["number"],
        "additionalProperties": true,
        "properties": {
          "number": { "type": "integer", "minimum": 1 },
          "type": { "type": "string", "enum": ["data", "audio"] },
          "size_bytes": { "type": ["integer", "null"], "minimum": 0 },
          "crc32": {
            "type": ["string", "null"],
            "pattern": "^[0-9a-f]{8}$"
          },
          "md5": {
            "type": ["string", "null"],
            "pattern": "^[0-9a-f]{32}$"
          },
          "sha1": {
            "type": ["string", "null"],
            "pattern": "^[0-9a-f]{40}$"
          }
        },
        "anyOf": [
          { "required": ["crc32"] },
          { "required": ["md5"] },
          { "required": ["sha1"] }
        ]
      }
    },
    "cuesheet_sha1": {
      "type": ["string", "null"],
      "pattern": "^[0-9a-f]{40}$"
    },
    "disc_structure": {
      "type": ["object", "null"],
      "additionalProperties": true,
      "properties": {
        "layer_break": { "type": ["integer", "null"] },
        "ring_mastering_codes": {
          "type": "array",
          "items": { "type": "string" }
        },
        "mould_sid": { "type": ["string", "null"] },
        "ifpi": { "type": ["string", "null"] }
      }
    },
    "dumpers": {
      "type": "array",
      "items": { "type": "string" }
    },
    "date_added": { "type": ["string", "null"] },
    "date_last_modified": { "type": ["string", "null"] },
    "redump_url": {
      "type": "string",
      "pattern": "^https?://redump\\.org/disc/[0-9]+/?$"
    },
    "scraped_at": {
      "type": "string",
      "description": "ISO 8601 timestamp of when this row was last fetched/parsed"
    },
    "artwork": {
      "description": "Reserved for future artwork archival. Omit or set null until populated.",
      "type": ["object", "null"]
    }
  }
}
